{
  "$schema": "https://json-schema.org/draft/2020-12/schema",
  "$id": "https://xcodebuildmcp.com/schemas/structured-output/xcodebuildmcp.output.simulator-action-result/1.schema.json",
  "type": "object",
  "additionalProperties": false,
  "allOf": [
    {
      "$ref": "https://xcodebuildmcp.com/schemas/structured-output/_defs/common.schema.json#/$defs/errorConsistency"
    }
  ],
  "properties": {
    "schema": {
      "const": "xcodebuildmcp.output.simulator-action-result"
    },
    "schemaVersion": {
      "const": "1"
    },
    "didError": {
      "type": "boolean"
    },
    "error": {
      "type": [
        "string",
        "null"
      ]
    },
    "data": {
      "type": "object",
      "additionalProperties": false,
      "properties": {
        "summary": {
          "$ref": "https://xcodebuildmcp.com/schemas/structured-output/_defs/common.schema.json#/$defs/statusSummary"
        },
        "action": {
          "oneOf": [
            {
              "type": "object",
              "additionalProperties": false,
              "properties": {
                "type": {
                  "const": "boot"
                }
              },
              "required": [
                "type"
              ]
            },
            {
              "type": "object",
              "additionalProperties": false,
              "properties": {
                "type": {
                  "const": "erase"
                }
              },
              "required": [
                "type"
              ]
            },
            {
              "type": "object",
              "additionalProperties": false,
              "properties": {
                "type": {
                  "const": "open"
                }
              },
              "required": [
                "type"
              ]
            },
            {
              "type": "object",
              "additionalProperties": false,
              "properties": {
                "type": {
                  "const": "reset-location"
                }
              },
              "required": [
                "type"
              ]
            },
            {
              "type": "object",
              "additionalProperties": false,
              "properties": {
                "type": {
                  "const": "set-location"
                },
                "coordinates": {
                  "type": "object",
                  "additionalProperties": false,
                  "properties": {
                    "latitude": {
                      "type": "number",
                      "minimum": -90,
                      "maximum": 90
                    },
                    "longitude": {
                      "type": "number",
                      "minimum": -180,
                      "maximum": 180
                    }
                  },
                  "required": [
                    "latitude",
                    "longitude"
                  ]
                }
              },
              "required": [
                "type",
                "coordinates"
              ]
            },
            {
              "type": "object",
              "additionalProperties": false,
              "properties": {
                "type": {
                  "const": "set-appearance"
                },
                "appearance": {
                  "type": "string"
                }
              },
              "required": [
                "type",
                "appearance"
              ]
            },
            {
              "type": "object",
              "additionalProperties": false,
              "properties": {
                "type": {
                  "const": "statusbar"
                },
                "dataNetwork": {
                  "type": "string"
                }
              },
              "required": [
                "type"
              ]
            },
            {
              "type": "object",
              "additionalProperties": false,
              "properties": {
                "type": {
                  "const": "toggle-software-keyboard"
                }
              },
              "required": [
                "type"
              ]
            },
            {
              "type": "object",
              "additionalProperties": false,
              "properties": {
                "type": {
                  "const": "toggle-connect-hardware-keyboard"
                }
              },
              "required": [
                "type"
              ]
            }
          ]
        },
        "artifacts": {
          "type": "object",
          "additionalProperties": false,
          "properties": {
            "simulatorId": {
              "type": "string"
            }
          },
          "required": [],
          "minProperties": 1
        },
        "diagnostics": {
          "$ref": "https://xcodebuildmcp.com/schemas/structured-output/_defs/common.schema.json#/$defs/basicDiagnostics"
        }
      },
      "required": [
        "summary",
        "action"
      ]
    }
  },
  "required": [
    "schema",
    "schemaVersion",
    "didError",
    "error",
    "data"
  ]
}
