{
  "schema": "xcodebuildmcp.output.simulator-action-result",
  "schemaVersion": "1",
  "didError": false,
  "error": null,
  "data": {
    "summary": {
      "status": "SUCCEEDED"
    },
    "action": {
      "type": "toggle-software-keyboard"
    },
    "artifacts": {
      "simulatorId": "<UUID>"
    }
  }
}
